tp,q,a,txt,src,domain,set
Simple,Какова цель Политики ООО «Интернет Решения» в отношении обработки персональных данных?,"Соблюдение и защита прав и свобод каждого человека, в особенности права на неприкосновенность частной жизни.","""1.1. Политика ООО «Интернет Решения» определяет позицию и намерения Общества в области обработки и защиты персональных данных...""",https://docs.ozon.ru/legal/personal-data/ru/ir/?__rr=1,law,ozon
With errors,"Кто несёт отвэтственность перед субъктом персональных даных за дейсвия абработчика? (Ошибка: опечатки в словах ""ответственность"", ""субъектом"", ""данных"", ""действия"", ""обработчика"")",Оператор.,"""2.5. Оператор несет ответственность перед субъектом персональных данных за действия или бездействия обработчика.""",https://docs.ozon.ru/legal/personal-data/ru/ir/?__rr=1,law,ozon
Trash,"Скажите, вот если Озон передает мои данные какой-то другой компании, ну, там, не знаю, там, курьерской службе, например, то кто вообще отвечает за то, что они там с моими данными делают?","ООО ""Интернет Решения"" (Оператор), как организация, передавшая данные.","""3.6. Общество вправе поручить обработку персональных данных Обработчикам на основании заключаемых с ними договоров.""",https://docs.ozon.ru/legal/personal-data/ru/ir/?__rr=1,law,ozon
Reformulation,"Означает ли, что ООО «Интернет Решения» может передавать персональные данные третьим лицам без согласия субъекта, если это необходимо для исполнения договора?","Да, если это необходимо для исполнения договора и есть правовые основания.","""3.7. При наличии соответствующих правовых оснований...""",https://docs.ozon.ru/legal/personal-data/ru/ir/?__rr=1,law,ozon
Incorrect by design,"Может ли Ozon передавать персональные данные пользователей правоохранительным органам других стран, если это противоречит российскому законодательству?","Нет, Ozon передает персональную информацию правоохранительным органам только в соответствии с применимым законодательством.",,https://docs.ozon.ru/legal/personal-data/ru/ir/?__rr=1,law,ozon
Table,,,В данном документе отсутствуют таблицы.,https://docs.ozon.ru/legal/personal-data/ru/ir/?__rr=1,law,ozon
No info,"Каков размер штрафа, наложенного на Ozon за нарушение закона о персональных данных в 2024 году?",В тексте нет информации о штрафах за нарушение закона о персональных данных.,Неприменимо: Вопрос не относится к тексту.,https://docs.ozon.ru/legal/personal-data/ru/ir/?__rr=1,law,ozon
,,,,,law,ozon
Simple,В соответствии с чем составлена политика обработки запросов субъектов персональных данных?,В соответствии с Федеральным законом Российской Федерации.,"""1.1. Настоящая политика составлена в соответствии с Федеральным законом Российской Федерации.""",https://docs.ozon.ru/legal/personal-data/ru/oi/,law,ozon
With errors,"Какой срок отводится аператору дла рассмотрения запроса субъекта пэрсональных данных? (Ошибка: опечатки в словах ""оператору"", ""для"", ""рассмотрения"", ""персональных"")",30 дней.,"""3.5. Срок рассмотрения Запроса и направления мотивированного ответа субъекту персональных данных не может превышать 30 (тридцать) дней...""",https://docs.ozon.ru/legal/personal-data/ru/oi/,law,ozon
Trash,"Слушайте, вот если я хочу узнать, что там Ozon делает с моими данными, ну, вообще, что они там собирают... как я вообще могу узнать, что они там делают с моими данными?","Нужно направить запрос Оператору (ООО ""Интернет Решения"") в порядке, установленном политикой и законом.","""2.1. Субъект персональных данных имеет право на получение информации...""",https://docs.ozon.ru/legal/personal-data/ru/oi/,law,ozon
Reformulation,"Означает ли, что Ozon обязан предоставить субъекту персональных данных информацию о третьих лицах, которым были переданы его данные?","Да, Ozon обязан предоставить информацию об осуществляемой трансграничной передачи данных.","""2.1.1 подтверждение факта обработки персональных данных Оператором;...""",https://docs.ozon.ru/legal/personal-data/ru/oi/,law,ozon
Incorrect by design,"Может ли Ozon игнорировать запрос субъекта персональных данных, если посчитает его необоснованным?","Нет, Ozon обязан предоставить мотивированный ответ в течение 30 дней.","""3.5. Срок рассмотрения Запроса и направления мотивированного ответа...""",https://docs.ozon.ru/legal/personal-data/ru/oi/,law,ozon
Table,,,В данном документе отсутствуют таблицы.,https://docs.ozon.ru/legal/personal-data/ru/oi/,law,ozon
No info,"Каков средний размер компенсации, выплачиваемой Ozon субъектам персональных данных за незаконную обработку их данных?",В тексте нет информации о компенсациях за незаконную обработку данных.,Неприменимо: Вопрос не относится к тексту.,https://docs.ozon.ru/legal/personal-data/ru/oi/,law,ozon
,,,,,law,ozon
Simple,Какие данные собирает Ozon при использовании сайта или приложения?,"Данные устройства и подключения, данные об использовании сайта или приложения, данные о местоположении.","""Мы собираем информацию, когда вы используете сайт или приложение...""",https://docs.ozon.ru/legal/personal-data/privacy-policy/,law,ozon
With errors,"С какими целяме озон может использовать данные пользавателя? (Ошибка: опечатки в словах ""целями"", ""Озон"", ""пользователя"")","Предоставлять услуги, улучшать услуги и показывать рекламу пользователю.","""Мы используем информацию для отправки вам рекламных сообщений...""",https://docs.ozon.ru/legal/personal-data/privacy-policy/,law,ozon
Trash,"Слушайте, ну вот я пользуюсь Ozon... что они вообще делают с моими данными? Можно как-то узнать?",Чтобы предоставлять и улучшать услуги и показывать рекламу пользователю.,"""Мы используем информацию для отправки вам рекламных сообщений...""",https://docs.ozon.ru/legal/personal-data/privacy-policy/,law,ozon
Reformulation,Означает ли согласие с Политикой конфиденциальности Ozon согласие на получение рекламных рассылок?,"Да, если вы дали согласие на их получение.","""Мы можем использовать вашу информацию для отправки вам рекламных сообщений...""",https://docs.ozon.ru/legal/personal-data/privacy-policy/,law,ozon
Incorrect by design,Может ли Ozon продавать персональные данные пользователей третьим лицам для получения прибыли?,Нет.,"""Нет информации о продаже личных данных.""",https://docs.ozon.ru/legal/personal-data/privacy-policy/,law,ozon
Table,,,В данном документе отсутствуют таблицы.,https://docs.ozon.ru/legal/personal-data/privacy-policy/,law,ozon
No info,"Каков процент пользователей Ozon, отказавшихся от получения рекламных рассылок?",В тексте нет информации о проценте отказавшихся от рассылок.,Неприменимо: Вопрос не относится к тексту.,https://docs.ozon.ru/legal/personal-data/privacy-policy/,law,ozon
,,,,,,ozon
Simple,"Что понимается под ""Товаром"" в контексте оферты ""Коммерческая поставка""?","Любое движимое имущество, предлагаемое Поставщиком к продаже на Сайте Ozon.","""«Товар» — любое движимое имущество (вещь), предлагаемое Поставщиком к продаже посредством размещения на Сайте Ozon.""",https://docs.ozon.ru/legal/partners/shipment/ru/commercial-supply/,law,ozon
With errors,"Какая атветственность предусмотрена для паставщика в случае нарушения сроков паставки тавара? (ошибка: опечатки в словах ""ответственность"", ""поставщика"", ""поставки"", ""товара"")",Уплата неустойки.,"""5.2. В случае нарушения Поставщиком сроков поставки Товара, Ozon вправе потребовать от Поставщика уплаты неустойки.""",https://docs.ozon.ru/legal/partners/shipment/ru/commercial-supply/,law,ozon
Trash,"Слушайте, вот если я поставщик... И вот что будет если я вовремя не поставлю товар... какие там штрафы вообще?",Ozon вправе потребовать уплаты неустойки.,"""5.2. В случае нарушения Поставщиком сроков поставки Товара, Ozon вправе потребовать от Поставщика уплаты неустойки.""",https://docs.ozon.ru/legal/partners/shipment/ru/commercial-supply/,law,ozon
Reformulation,"Означает ли принятие оферты ""Коммерческая поставка"", что поставщик согласен с правом Ozon на одностороннее изменение условий оферты?",Да.,"""11.1. Ozon вправе в одностороннем порядке вносить изменения в настоящую Оферту...""",https://docs.ozon.ru/legal/partners/shipment/ru/commercial-supply/,law,ozon
Incorrect by design,"Может ли Ozon взимать с поставщика комиссию, не указанную в оферте ""Коммерческая поставка""?",Нет.,"""В тексте прописаны все условия и положения.""",https://docs.ozon.ru/legal/partners/shipment/ru/commercial-supply/,law,ozon
Table,,,В данном документе отсутствуют таблицы.,https://docs.ozon.ru/legal/partners/shipment/ru/commercial-supply/,law,ozon
No info,"Каков средний размер комиссии, взимаемой Ozon с поставщиков по оферте ""Коммерческая поставка"" в 2024 году?",В тексте нет информации о среднем размере комиссии.,Неприменимо: Вопрос не относится к тексту.,https://docs.ozon.ru/legal/partners/shipment/ru/commercial-supply/,law,ozon
,,,,,law,ozon
Simple,Какое право применимо к отношениям между Ozon и B2B клиентом?,Законодательство Российской Федерации.,"""Настоящие Условия регулируются и толкуются в соответствии с законодательством Российской Федерации.""",https://docs.ozon.ru/legal/partners/b2b/standard-terms/,law,ozon
With errors,"Какие спосабы размещения заказа даступны для B2B клиентов соглосно стандратным условиям? (ошибка: опечатки в словах ""способы"", ""доступны"", ""согласно"", ""стандартным"")","Через личный кабинет или иным способом, согласованным с Ozon.","""B2B Клиент может разместить Заказ через Личный кабинет или иным способом, согласованным с Ozon.""",https://docs.ozon.ru/legal/partners/b2b/standard-terms/,law,ozon
Trash,"Слушайте, вот я B2B клиент... И как я вообще могу сделать заказ... какие там способы есть?",Через личный кабинет или другим способом.,"""B2B Клиент может разместить Заказ через Личный кабинет или иным способом, согласованным с Ozon.""",https://docs.ozon.ru/legal/partners/b2b/standard-terms/,law,ozon
Reformulation,Означает ли регистрация в качестве B2B клиента Ozon автоматическое согласие на получение рекламных материалов?,Неизвестно.,Данный аспект не урегулирован.,https://docs.ozon.ru/legal/partners/b2b/standard-terms/,law,ozon
Incorrect by design,Может ли Ozon в одностороннем порядке повысить цены на товары для B2B клиентов после оформления заказа?,Неизвестно.,Данный аспект не урегулирован.,https://docs.ozon.ru/legal/partners/b2b/standard-terms/,law,ozon
Table,,,В данном документе отсутствуют таблицы.,https://docs.ozon.ru/legal/partners/b2b/standard-terms/,law,ozon
No info,Каков средний объем закупок B2B клиентов на Ozon в месяц?,В тексте нет информации о среднем объеме закупок.,Неприменимо: Вопрос не относится к тексту.,https://docs.ozon.ru/legal/partners/b2b/standard-terms/,law,ozon
,,,,,,ozon
Simple,На что направлена политика обработки персональных данных кандидатов?,Определение общих принципов и порядка обработки персональных данных кандидатов.,"""Настоящая Политика определяет общие принципы и порядок обработки персональных данных кандидатов на трудоустройство в ООО «Интернет Решения»...""",https://docs.ozon.ru/legal/partners/candidates/personnel/,law,ozon
With errors,"Какие права имеит кандитат в атношении сваих персональных данныч, абрабатываемых яндексом? (Ошибка: опечатки в словах ""имеет"", ""кандидат"", ""отношении"", ""своих"", ""данных"", ""обрабатываемых"")",Право на получение информации об обработке своих персональных данных.,"""Кандидат имеет право на получение информации, касающейся обработки его персональных данных...""",https://docs.ozon.ru/legal/partners/candidates/personnel/,law,ozon
Trash,"Слушайте, вот я устраиваюсь на работу в Ozon, да? И что они вообще делают с моими данными, ну, зачем они им нужны, ну, вообще, можно как-то узнать, что они там делают с моими данными, ну, если я кандидат, да? Ну, расскажите вкратце, да?",Кандидат имеет право на получение информации об обработке своих персональных данных.,"""Кандидат имеет право на получение информации, касающейся обработки его персональных данных...""",https://docs.ozon.ru/legal/partners/candidates/personnel/,law,ozon
Reformulation,Означает ли направление резюме в Ozon согласие на обработку персональных данных указанных в резюме?,Неизвестно.,Данный аспект не урегулирован.,https://docs.ozon.ru/legal/partners/candidates/personnel/,law,ozon
Incorrect by design,Может ли Ozon отказать в трудоустройстве кандидату на основании его политических взглядов?,Неизвестно.,Нет информации об использовании персональных данных для оценки политических взглядов.,https://docs.ozon.ru/legal/partners/candidates/personnel/,law,ozon
Table,,,В данном документе отсутствуют таблицы.,https://docs.ozon.ru/legal/partners/candidates/personnel/,law,ozon
No info,Каков средний срок рассмотрения резюме кандидата в Ozon в 2024 году?,В тексте нет информации о среднем сроке рассмотрения резюме.,Неприменимо: Вопрос не относится к тексту.,https://docs.ozon.ru/legal/partners/candidates/personnel/,law,ozon
,,,,,law,ozon
Simple,Что является предметом договора хранения товара?,Хранение товара Поставщика на складе Оператора.,"""Предмет договора — хранение товара Поставщика на складе Оператора.""",https://docs.ozon.ru/legal/partners/warehouseman/contract/,law,ozon
With errors,"Какая атветственность прадусмотрена для хранения товара в случаи его утраты? (Ошибка: опечатки в словах ""ответственность"", ""предусмотрена"", ""случае"")",Возмещение убытков Поклажедателя.,"""В случае утраты Товара Оператор обязан возместить убытки Поклажедателя.""",https://docs.ozon.ru/legal/partners/warehouseman/contract/,law,ozon
Trash,Вот скажите если Ozon потеряет товар...,Оператор обязан возместить убытки Поклажедателя.,"""В случае утраты Товара Оператор обязан возместить убытки Поклажедателя.""",https://docs.ozon.ru/legal/partners/warehouseman/contract/,law,ozon
Reformulation,Означает ли договор хранения товара автоматическое согласие сторон на изменение условий хранения без уведомления?,Неизвестно.,Данный аспект не урегулирован.,https://docs.ozon.ru/legal/partners/warehouseman/contract/,law,ozon
Incorrect by design,Имеет ли право Оператор увеличивать стоимость хранения без предварительного уведомления?,Неизвестно.,Данный аспект не урегулирован.,https://docs.ozon.ru/legal/partners/warehouseman/contract/,law,ozon
Table,,,В данном документе отсутствуют таблицы.,https://docs.ozon.ru/legal/partners/warehouseman/contract/,law,ozon
No info,Какова средняя стоимость хранения товаров у Озона за месяц?,В тексте нет информации о стоимости хранения товаров.,Неприменимо: Вопрос не относится к тексту.,https://docs.ozon.ru/legal/partners/warehouseman/contract/,law,ozon
,,,,,,ozon
multi-block,"Какова последовательность действий для заключения договора между Заказчиком и Исполнителем, и какие условия должны быть выполнены, чтобы договор считался незаключенным?","Для заключения договора Исполнитель должен пройти авторизацию, заполнить анкету в ИС Заказчика и акцептовать договор после успешной проверки документов. Заказчик активирует Исполнителя в своей ИС, после чего начинается исполнение договора. Однако, Заказчик имеет право отказать в доступе к акцепту договора без объяснения причин, в таком случае договор считается незаключенным, и у сторон не возникают права и обязанности, предусмотренные договором.","3. Порядок заключения и изменения Договора, 3.1, 3.2",https://docs.ozon.ru/legal/partners/warehouseman/contract/,law,ozon
multi-block,"Какие документы должен предоставить Исполнитель, являющийся гражданином РФ, для оказания услуг, и в каком случае он может указать банковские реквизиты третьего лица?","Гражданин РФ должен предоставить паспорт, документ о регистрации, СНИЛС, ИНН и банковские реквизиты, оформленные на Исполнителя. Исполнители, оказывающие услуги на объектах Ozon fresh, вправе указать банковские реквизиты третьего лица, в пользу которого будут происходить платежи по договору.","5. Права и обязанности Сторон, 5.1, 5.1.10",https://docs.ozon.ru/legal/partners/warehouseman/contract/,law,ozon
