tp,q,a,txt,src,domain,set
With errors,"Какие факторы влияют на расчёт дахода доставщика, согласно дакументу?",Информация о выполненных Доставщиком Заказах.,"Раздел 2: ""Размер Дохода Доставщика рассчитывается на основании информации о выполненных Доставщиком Заказах.""",https://yandex.ru/legal/procedure_dostavschik/,law,yandex
Trash,"Ну, вот я слышал, что Яндекс как-то платит этим доставщикам... И как они там вообще платят...","Доход — это сумма, которую Яндекс платит доставщику за каждый выполненный заказ за вычетом комиссий.","Раздел 1: ""Доход Доставщика — сумма, перечисляемая Сервисом Доставщику за каждый выполненный Заказ...""",https://yandex.ru/legal/procedure_dostavschik/,law,yandex
Reformulation,"Означает ли, что размер дохода доставщика может быть изменен Яндексом в одностороннем порядке?",В тексте нет информации об одностороннем изменении размера дохода.,,https://yandex.ru/legal/procedure_dostavschik/,law,yandex
Incorrect by design,Имеет ли право Яндекс вычитать из дохода доставщика штрафы за нарушение правил дорожного движения?,В тексте нет информации о штрафах за нарушение ПДД.,,https://yandex.ru/legal/procedure_dostavschik/,law,yandex
Table,,,В данном документе отсутствуют таблицы.,https://yandex.ru/legal/procedure_dostavschik/,law,yandex
No info,Каков средний доход доставщика Яндекс.Еды в Москве в 2024 году?,В тексте нет информации о среднем доходе доставщика.,Неприменимо: Вопрос не относится к тексту.,https://yandex.ru/legal/procedure_dostavschik/,law,yandex
